id,bid,user_id,用户昵称,微博正文,头条文章url,发布位置,艾特用户,话题,转发数,评论数,点赞数,发布时间,发布工具,微博图片url,微博视频url,retweet_id
4650174254944397,Kl3gdkKgl,1645012932,番茄小盆友,//@瓜皮的id酱:绝了//@你应该看见四牌楼船长:给个群号有钱一起赚//@待进化体:我吐了//@兔饺饺:原来不是反讽……//@M大王叫我来巡山:爆笑了，在想当然的胡乱自问自答些什么呢´_>`//@Tiger公子://@小乔有猫:“说老婆三胎正好有了事业转型的机会——这句振聋发聩的话势必会被刻在中国广告史的耻辱柱上,,,"瓜皮的id酱,你应该看见四牌楼船长,待进化体,兔饺饺,M大王叫我来巡山,Tiger公子,小乔有猫",,0,0,0,2021-06-20 14:44,微博 HTML5 版,,,4649569311525848
4650174209066521,Kl3g8C2Cd,5984962646,当克瑞斯爱上帝,#童瑶网不好变成三倍营业#这是有多不舍对林楠笙的情啊，这么努力的奋起直追，希望最后在补上一刀同胞胎的登场补缺啊,,,,童瑶 网不好变成三倍营业,0,0,1,2021-06-20 14:43,360安全浏览器,"['http://ww1.sinaimg.cn/large/006x2ibAly1groq8py7vkj60tz1cdad702.jpg', 'http://ww4.sinaimg.cn/large/006x2ibAly1groq8pw764j30ub0e5q4r.jpg']",,
4650174167123866,Kl3g4tTf4,2169205203,这块豆干请留步,//@瓜皮的id酱:绝了//@你应该看见四牌楼船长:给个群号有钱一起赚//@待进化体:我吐了//@兔饺饺:原来不是反讽……//@M大王叫我来巡山:爆笑了，在想当然的胡乱自问自答些什么呢´_>`//@Tiger公子://@小乔有猫:“说老婆三胎正好有了事业转型的机会——这句振聋发聩的话势必会被刻在中国广告史的耻辱柱上,,,"瓜皮的id酱,你应该看见四牌楼船长,待进化体,兔饺饺,M大王叫我来巡山,Tiger公子,小乔有猫",,0,0,0,2021-06-20 14:43,iPhone,,,4649569311525848
4650174117055541,Kl3fZtBt3,6551783528,今天我叫早点睡哦,老公：“媳妇儿，国家放开三胎政策了，不然咱给宝宝生个妹妹作伴吧？”我：“好啊好啊，你看咱家现在两室一厅，再生个妹妹的话，兄妹俩也不能住在一起，那咱就得再换一套三室的房子，四个人的话一个卫生间可能也不太够用，得选有两个卫生间的。那到时候两个卫生间咱都用现在用的恒洁卫浴，这个牌子的卫浴质量还挺好的。还有还有..”老公：“好了别说了，我觉得咱一个宝宝挺好的，要什么妹妹”我...,,,,,0,0,0,2021-06-20 14:43,iPhone客户端,['http://ww3.sinaimg.cn/large/0079oCbSgy1groq89l8afj30m80m8wfx.jpg'],,
4650174108929128,Kl3fYBsSc,5701096060,红豆布丁双拼n芋泥红茶啵啵,//@Macondo_7:我们不是反对三胎，是反对这种只站在父亲视角、高高在上的姿态，生育风险、养育成本、职场发展停滞这些实际问题都是母亲们面对的，为什么不听取她们的声音呢？这也是一个健康的社会应该有的样子吗？支持不是上嘴皮子碰下嘴皮子，是实际行动。在上面太久了啦，脱离群众了。,,,Macondo_7,,0,0,0,2021-06-20 14:43,iPhone客户端,,,4649569311525848
4650159168556904,Kl2RSzU2A,7242267707,撒欢儿儿儿儿儿儿儿儿儿,//@蒋胜男:按新闻热点尿性，这标题难道不应该叫#女子怀三胎迎来灭顶之灾，因丈夫失女瘫痪反被遗弃#为丈夫追三胎，为寻夫遭车祸，失长女失胎儿自己瘫痪，丈夫卷跑所有钱提出离婚👿👿👿,,,蒋胜男,女子怀三胎迎来灭顶之灾，因丈夫失女瘫痪反被遗弃,0,0,0,2021-06-20 13:43,Redmi 10X 全芯超越,,,4649851578745349
4650159093318492,Kl2RLdVi4,6272915108,可爱的发芽-,博君一肖周边中转出琑了衣橱同台娃衣，或者换三胞胎的云朵恰恰和甜筒可可,,,,,0,1,0,2021-06-20 13:43,博君一肖周边中转超话,['http://ww3.sinaimg.cn/large/006QwvM8ly1groohdtv7pj30u00zwq78.jpg'],,
4650158824360458,Kl2RkiilY,2236432537,太宰优子_今天汪出TV第二季了吗,笑死了，自己生吧，这是来自女人的真诚发声//@梓宅宅_Law:？？？笑死，支持生三胎的男人哈哈哈哈哈,,,梓宅宅_Law,,0,0,0,2021-06-20 13:42,青花鱼的Android,,,4649569311525848
4649741553764344,KkS0jfNhe,2613521867,新乡鲍勃迪伦,个逼图…,,,,,47,93,805,2021-06-19 10:03,iPhone客户端,['http://ww1.sinaimg.cn/large/9bc72dcbly1grncjsc1vtj20ft0zkq5p.jpg'],,
4650158761445058,Kl2Re63Vo,6573100284,神鹰黑手备考版,谁//@老恰没:谁是共和国第三胎,,,老恰没,,0,0,0,2021-06-20 13:41,iPhone客户端,,,4649741553764344
4650158756727856,Kl2RdsedO,2731962922,Livas玉白,发布了头条文章：《90%二胎妈妈不知道大娃正在嫉妒：“她小不懂事，你让让她！”》#三孩生育政策来了##青少年抑郁症门诊量逐年递增#O90%二胎妈妈不知道大娃正在嫉妒：“她小不懂事，你让让她！”,http://t.cn/A6f731O9,,,"三孩生育政策来了,青少年抑郁症门诊量逐年递增",0,0,1,2021-06-20 13:41,微博 weibo.com,,,
4650158744930619,Kl2RckGG7,1898495494,ZAKER,"【带70研究生却教不好女儿，重大教授：生三胎或能缓解教育焦虑】重庆一教授官网资料写着“虽指导的研究生已超过70名,依然对初中生女儿的教育束手无策”,本人发声:三胎或缓解教育焦虑O带70研究生却教不好女儿，重大教授：生三胎或能缓解教育焦虑",,,,,1,3,0,2021-06-20 13:41,ZAKER扎客新闻,,,
4650158720287601,Kl2Ra1cOJ,6901625209,老鼠爱上猫小娱,发布了头条文章：《陈凯琳追生三胎求个女？郑嘉颖被爆做恶爸闹两仔！》O陈凯琳追生三胎求个女？郑嘉颖被爆做恶爸闹两仔！,http://t.cn/A6f733kz,,,,0,0,0,2021-06-20 13:41,微博 weibo.com,,,
4650158614643773,Kl2QZju3z,7156954661,你再说一遍ee,苏叶寄语轩爸父亲节快乐！！！三胎政策了！！！快快快，直接一年三个，生来给我们玩玩,,,,,0,2,0,2021-06-20 13:41,苏叶寄语超话,,,
4650158590266619,Kl2QX17mj,5995406972,将阮攥牢的海却阔,好无语昨晚我还在想从周五晚上开始喝酒周末就仿佛有三天好开心今天一觉起来就在跟我妈吵架滚吧家庭生活就无语看啥都不顺眼我又在看深海晶干活又在看男的嘴三胎疯了吧是我还不够疯才这么痛苦我直接疯去精神病院让别人痛苦可以吗,,,,,0,1,0,2021-06-20 13:41,iPhone客户端,,,
4650158539935050,Kl2QRFGyK,5285639741,-Uri,你爹生你的时候是把脑子和脐带一起剪了吗爹味这么浓还能当策划吓死人惹//@鹿麋不屿:你支持？你拿什么支持？手伸到别人身上了还，我支持男人自宫//@杨烨炘ForestYoung:你有反对三胎的权利，我也有支持三胎的权利，一个健康的社会应该容得下不同的意见,,,"鹿麋不屿,杨烨炘ForestYoung",,0,0,0,2021-06-20 13:40,iPhone,,,4649569311525848
4650158538884175,Kl2QRBhb9,2591247081,安咕小宝贝,以后我一定不会逼我的孩子结婚，结婚or不结婚or丁克or三胎都充分尊重他的意愿。,,,,,0,0,0,2021-06-20 13:40,iPhone客户端,,,4650114726233791
4650158534690073,Kl2QRjG6l,1113472844,三gz只小熊饼干,分享网易新闻《带70研究生却教不好女儿，重大教授张小强：生三胎或能缓解教育焦虑》O带70研究生却教不好女儿，重大教授张小强：生三胎或能缓解教育焦虑来自@网易新闻客户端#网易新闻#,,,网易新闻客户端,网易新闻,0,0,0,2021-06-20 13:40,网易新闻客户端,['http://ww4.sinaimg.cn/large/425e3f4cly1groofx48iuj20go08swfg.jpg'],,
4650158437961519,Kl2QHxp9B,6346087049,再见安歇iz,一不小心怀了三胞胎，却不知生父是谁，被渣男背叛，被家族驱逐。华丽转身，带萌宝归来，她发誓夺回自己失去的一切。女总裁霸气上线，却半路杀出个程咬金。“妈咪，这个爹地我要了！”“爹地，这个富婆妈咪，我们帮你追！”三小只密谋牵线。,,,,,0,0,0,2021-06-20 13:40,皮皮时光机,"['http://ww1.sinaimg.cn/large/006Vtx8Jly8groofbkyegj30c82hfgrw.jpg', 'http://ww1.sinaimg.cn/large/006Vtx8Jly8groofe5oehj30c83837d3.jpg', 'http://ww4.sinaimg.cn/large/006Vtx8Jly8groofjn98kj30c83197ck.jpg']",,
4649568190599684,KkNuH2w0k,2804610542,城南邮局,#好看视频父亲节特别呈现#八位父亲为三胎发声：只要思想不滑坡，办法总比问题多！祝父亲节快乐！L史史大力的微博视频,,,,好看视频 父亲节特别呈现,308,292,1352,2021-06-18 22:35,微博视频号,,"http://f.video.weibocdn.com/sBlttZ3Clx07NyHw8fGw01041200q32X0E010.mp4?label=mp4_ld&template=640x360.25.0&trans_finger=40a32e8439c5409a63ccf853562a60ef&ori=0&ps=1BVp4ysnknHVZu&Expires=1624177885&ssig=ByUlddWsGf&KID=unistore,video",
4650158380026587,Kl2QC06UP,2423398290,Celestial-BLUE,三胎不问问母亲？,,,,,0,0,0,2021-06-20 13:40,微博国际版,,,4649568190599684
4650158379761694,Kl2QBEXsG,5950178388,斯呆夫i,订婚结婚生孩子满月百日兄弟们加油，看看谁先生出二胎三孩四伙计,,,,,0,1,0,2021-06-20 13:40,,,,
4650158342538568,Kl2QyaEoE,6218081249,恬妞挖白菜,发布了头条文章：《蔡少芬与儿子同框被嘲像“奶奶”，生了三胎后的她，身材依然很好》O蔡少芬与儿子同框被嘲像“奶奶”，生了三胎后的她，身材依然很好,http://t.cn/A6f73R1O,,,,0,0,0,2021-06-20 13:40,微博 weibo.com,,,
4650158342538464,Kl2QyaEmY,6073527514,是怪兽呀丶,我再说一遍，没有子宫就没有发言权，还有多少狗不明白这个热知识？//@顾惜之:怎么不叫准备生三胎的母亲们发个言//@Tiger公子://@小乔有猫:“说老婆三胎正好有了事业转型的机会——这句振聋发聩的话势必会被刻在中国广告史的耻辱柱上”,,,"顾惜之,Tiger公子,小乔有猫",,0,0,0,2021-06-20 13:40,See微博客户端,,,4649569311525848
4650158204126241,Kl2Qkhjqh,1806709994,梦里没有无情的光阴,//@想冬眠的十万:我记得之前还有在派出所砍死的新闻//@Jack贝萨流士的badbed:不太理解哈，我寻思育龄女性离婚了找下一个一样能生，砍死了那可是几胎都没戏了。果然咱国家还是觉得女性数量太多了吧//@马库斯说://@Hu言一派:条条举措“帮助”落实你赶紧生三胎，但日常家暴离婚怎么保命,,,"想冬眠的十万,Jack贝萨流士的badbed,马库斯说,Hu言一派",,1,0,0,2021-06-20 13:39,HUAWEI P40 Pro+ 5G,,,4649836395627774
4650158178436450,Kl2QhzoHM,5644141149,清扬18197077,三胎政策，先对教育下手，减少限制校外培训机构，也是一种变相降低老百姓的教育成本，从而达到生三个孩子的目地,,常熟市,,,0,0,1,2021-06-20 13:39,Android客户端,,,
4650143297045870,Kl2shtyX4,1224275137,他不是个坏人,一不小心怀了三胞胎，却不知生父是谁，被渣男背叛，被家族驱逐。华丽转身，带萌宝归来，她发誓夺回自己失去的一切。女总裁霸气上线，却半路杀出个程咬金。“妈咪，这个爹地我要了！”“爹地，这个富婆妈咪，我们帮你追！”三小只密谋牵线。,,,,,0,0,0,2021-06-20 12:40,皮皮时光机,"['http://ww2.sinaimg.cn/large/48f8f4c1ly8gromoszrjcj20c82hfgrw.jpg', 'http://ww4.sinaimg.cn/large/48f8f4c1ly8gromowjc95j20c83837d3.jpg', 'http://ww4.sinaimg.cn/large/48f8f4c1ly8gromoxu9okj20c83197ck.jpg']",,
4650143171477623,Kl2s56coD,1634833725,堂吉柯德有只小毛驴,//@蒋胜男:按新闻热点尿性，这标题难道不应该叫#女子怀三胎迎来灭顶之灾，因丈夫失女瘫痪反被遗弃#为丈夫追三胎，为寻夫遭车祸，失长女失胎儿自己瘫痪，丈夫卷跑所有钱提出离婚👿👿👿,,,蒋胜男,女子怀三胎迎来灭顶之灾，因丈夫失女瘫痪反被遗弃,0,0,0,2021-06-20 12:39,iPhone客户端,,,4649851578745349
4650143095456924,Kl2rXmTAU,6113326388,捕获星月-,我tm简直yue过去了//@小乔有猫:“说老婆三胎正好有了事业转型的机会——这句振聋发聩的话势必会被刻在中国广告史的耻辱柱上”,,,小乔有猫,,0,0,0,2021-06-20 12:39,完年姐姐iPhone客户端,,,4649569311525848
4650142995056222,Kl2rNldlY,1045241615,lovesea11,哈哈哈！我以为是反讽，这一看就是演的呀！也不怎么真诚！我也支持生三胎，你们男的自己生就可以了呀，现在医学这么发达！,,,,,0,0,0,2021-06-20 12:39,,,,4649569311525848
4650142844850370,Kl2ryklNM,1401862990,张晏维_Barrister,“三胎贷”“彩礼贷”“墓地贷”……本质都一样？！O网页链接,,,,,0,0,0,2021-06-20 12:38,iPhone客户端,,,
4650142759912040,Kl2rpFAzC,3026358785,雨寂瀮就是阿猫猫,不是，生不生三胎，为啥不问问母亲啊？当爹就直接决定生杀大权了？你让人家给你生，人家就必须给你生？好家伙，这个视频怎么说呢，就好奇怪啊,,,,,0,0,0,2021-06-20 12:38,荣耀V40 前所未感,,,4649569311525848
4650142634606693,Kl2rdjkpv,2499517714,yourenotgonnafindme,//@桃川_Caroline:yue了真的//@全世界最英俊的人:支持男性自己生，几胎都可以//@M大王叫我来巡山:爆笑了，在想当然的胡乱自问自答些什么呢´_>`//@Tiger公子://@小乔有猫:“说老婆三胎正好有了事业转型的机会——这句振聋发聩的话势必会被刻在中国广告史的耻辱柱上”,,,"桃川_Caroline,全世界最英俊的人,M大王叫我来巡山,Tiger公子,小乔有猫",,0,0,0,2021-06-20 12:37,iPhone,,,4649569311525848
4650142545742516,Kl2r4o5Te,1606911094,金丝狸猫京剧乐园,明知道年轻人一胎都不想生，其实开放三胎不是为了他们。#三胎妈妈#三胎#家庭婚姻情感##快手#@快手L喜大壮-情感频道的快手视频,,,快手,"三胎妈妈 ,家庭婚姻情感 ,快手",0,0,0,2021-06-20 12:37,微博视频号,,http://www.kuaishou.com/rest/kd/partner/weibo/linkcard/video?p=3xbxhb8w37tvcie&a=3xmwhdhahavmwu9&f=3xuz27sncjv8wdc&kpn=KUAISHOU&subBiz=BROWSE_SLIDE_PHOTO&shareChannel=weibo&shareMethod=card&shareObjectId=5196309592371835350&shareResourceType=PHOTO_OTHER&shareToken=X7YZb9XUQtKLBVU_A,
4650142529487803,Kl2r2DOd5,7101135166,小雨只爱大叔10,#腾讯新闻#一定是特别的缘分！温州三胞胎兄弟同天结婚O一定是特别的缘分！温州三胞胎兄弟同天结婚来自@腾讯新闻,,,腾讯新闻, 腾讯新闻 ,0,0,0,2021-06-20 12:37,iPhone客户端,['http://ww2.sinaimg.cn/large/007KzDEaly1gromlqwwccj30o60dojsd.jpg'],,
4650142526081382,Kl2r2pw2O,7017706309,红豆麻薯三分糖,//@刀卜作:“我要生三胎”：然后来出镜的全是男的，还有比这更讽刺的事吗，如此明目张胆地宣布男性对女性子宫和生育权的全面“占领“，世界上只此一家了吧。看着视频以为我国生殖技术猪突猛进，已实现男人三胎生子了呢。,,,刀卜作,,0,0,0,2021-06-20 12:37,iPhone 11,,,4649569311525848
4650142420436382,Kl2qS1Pwq,3717159045,拖延症孙某人,查看图片//@杨烨炘ForestYoung:你有反对三胎的权利，我也有支持三胎的权利，一个健康的社会应该容得下不同的意见,,,杨烨炘ForestYoung,,0,0,1,2021-06-20 12:36,微博国际版,,,4649569311525848
4650142260791843,Kl2qC3jZF,3238877770,一颗懒惰的凤梨,没子宫的人有什么发言权//@杨烨炘ForestYoung:你有反对三胎的权利，我也有支持三胎的权利，一个健康的社会应该容得下不同的意见,,,杨烨炘ForestYoung,,0,0,0,2021-06-20 12:36,HarmonyOS设备,,,4649569311525848
4650124096048658,Kl1Xjpnx0,5876442350,勤奋哥,中国科学家取得重大研究突破——成功将母老鼠的子宫和胚胎移植到公老鼠身上，公老鼠事实上怀孕了，最终通过剖腹产生下了小老鼠！！！这个研究的目的，细思恐极……男人生孩子，感觉也不远了。,,,,,47,32,223,2021-06-20 11:24,,"['http://ww4.sinaimg.cn/large/006pGX6ely1grokgmep62j30jj0m8wfj.jpg', 'http://ww4.sinaimg.cn/large/006pGX6ely1grokgmlkz1j30qy0v5adc.jpg', 'http://ww1.sinaimg.cn/large/006pGX6ely1grokgmsckjj30zk0r30x2.jpg', 'http://ww3.sinaimg.cn/large/006pGX6ely1grokgmz7a6j30u019vnca.jpg']",,
4650142253452686,Kl2qBeucu,3656918501,重山有云_,那恭喜未来的三胎爸爸们哦,,,,,0,0,0,2021-06-20 12:36,HUAWEI Mate 40,,,4650124096048658
4650142152265367,Kl2qr9vkb,2501514934,puiyeeg,飯局上聽到老一輩勸生三胎實在感受到生理不適,,,,,0,0,4,2021-06-20 12:35,🐰iPhone 12 Pro,,,
4650142144400439,Kl2qqisKP,2992349705,思行定止,《带70研究生却教不好女儿，重大教授：生三胎或能缓解教育焦虑》大家好，我是前段时间因为“指导过70个研究生却对初中生女儿的教育束手无策”上热搜的重庆大学教授张小强。O网页链接,,,,,0,0,0,2021-06-20 12:35,百度App,['http://ww2.sinaimg.cn/large/003gvAQVgy1gromk68htzj608o05s0sz02.jpg'],,
4650142139420656,Kl2qpDwK4,1938390155,卓异_铭,【每年教育50万元打底，90后互联网人敢“冲”三胎吗？】视频|三胎贷、墓地贷、彩礼贷……花式消费贷为何层出不穷？生娃...O每年教育50万元打底，90后互联网人敢“冲”三胎吗？@新浪财经,,,新浪财经,,0,0,0,2021-06-20 12:35,新浪财经Android版,,,
4650142130505275,Kl2qp27rB,6055710525,_尾牙之互联网回魂,八个正好四对，自己生去吧！！！//@赤楚衛二小可爱:脑子有病吧//@钮钴禄·沸腾饭:真是给我看吐了//@Uma31161://@小乔有猫:“说老婆三胎正好有了事业转型的机会——这句振聋发聩的话势必会被刻在中国广告史的耻辱柱上”,,,"赤楚衛二小可爱,钮钴禄,Uma31161,小乔有猫",,0,0,0,2021-06-20 12:35,微博国际版,,,4649569311525848
4650142097738154,Kl2qlwt2W,5031743974,吴三無_,//@小乔有猫:“说老婆三胎正好有了事业转型的机会——这句振聋发聩的话势必会被刻在中国广告史的耻辱柱上”,,,小乔有猫,,0,0,0,2021-06-20 12:35,Redmi K40,,,4649569311525848
4650142068114512,Kl2qiy2Xe,6399637691,Ajowan_,笑死咯男资本家//@keely_姬:支持右边//@饮风颂：作为一个公司的领导，建议您直接说“员工/员工妻子怀孕，我司愿意保留岗位+一年半时间满薪支付，我支持生三胎”，拿出决心来好吗？别喊口号//@杨烨炘ForestYoung:你有反对三胎的权利，我也有支持三胎的权利，一个健康的社会应该容得下不同的意见,,,"keely_姬,饮风颂,杨烨炘ForestYoung",,0,0,0,2021-06-20 12:35,HUAWEI P30,,,4649569311525848
4650128646607134,Kl24ErIOG,5516582282,三胞胎童心小铺,🦋蝴蝶给我🍧冰淇淋给你们！#三胞胎娃衣repo#『🍦甜筒可可』,,,,三胞胎娃衣repo,1,3,15,2021-06-20 11:42,,,,4650117842079001
4650128423519066,Kl24ieLt8,7091217590,你骂我你吃亏你就是个老乌龟,//@马库斯说://@Hu言一派:条条举措“帮助”落实你赶紧生三胎，但日常家暴离婚怎么保命，人家视而不见绝口不提,,,"马库斯说,Hu言一派",,0,0,0,2021-06-20 11:41,iPhone客户端,,,4649836395627774
4650128176318205,Kl23TqvEx,1647680111,童话发芽,如果男人能生孩子，我举双手双脚赞同三胎四胎多胎。加油,,,,,0,0,0,2021-06-20 11:40,HUAWEI P30 Pro,,,4650124096048658
4650128134900764,Kl23PkyUA,3014626727,不做沉默的人YDX,//@稳如__:追三胎的下场，你在路上/产房丢命，他卷走赔偿款（继承遗产）//@七月记忆的时光75://@赤练仙子S3:get✓//@蒋胜男:按新闻热点尿性，这标题难道不应该叫#女子怀三胎迎来灭顶之灾，因丈夫失女瘫痪反被遗弃#为丈夫追三胎，为寻夫遭车祸，失长女失胎儿自己瘫痪，丈夫卷跑所有钱提出离婚,,,"稳如__,七月记忆的时光75,赤练仙子S3,蒋胜男",女子怀三胎迎来灭顶之灾，因丈夫失女瘫痪反被遗弃,0,0,0,2021-06-20 11:40,OPPO随光而变R17,,,4649851578745349
4650128113401913,Kl23NegZz,1777740787,树袋熊抱抱大树,//@随心听V://@辣条娘:看得我血压上来了//@_暮雪潇潇_:过分搞笑了//@门门牙牙牙牙:你没有子宫你说个几把//@字幕少女:有大病//@有盐电影:采访一群生不了孩子的男人一个个眉飞色舞地说支持生三胎文案还说难不倒父亲生三胎难的是父亲吗？？？什么阴间广告策划（出自好看视频的父亲节广告,,,"随心听V,辣条娘,_暮雪潇潇_,门门牙牙牙牙,字幕少女,有盐电影",,0,0,0,2021-06-20 11:39,iPhone客户端,,,4649504262065885
4650128054944558,Kl23HkKiW,5678953758,洛夕炎,极度不要脸！有本事他们生娃事业被毁试试呗//@姑苏城外洗剪吹:我支持他们去死//@起肖蔷:魔幻到我竟然词穷了//@小乔有猫:“说老婆三胎正好有了事业转型的机会——这句振聋发聩的话势必会被刻在中国广告史的耻辱柱上”,,,"姑苏城外洗剪吹,起肖蔷,小乔有猫",,0,0,0,2021-06-20 11:39,iPhone客户端,,,4649569311525848
4650128047082182,Kl23GtIoK,1790115431,小于小于在线摸鱼儿,俊哲今晚的直播我要把名字改成龚俊和张哲瀚的粉丝小于，但我姐妹说她要改成龚俊和张哲瀚的三胎,,,,,0,14,3,2021-06-20 11:39,俊哲超话,,,
4650128041837180,Kl23G7HVW,5997532107,Mabel呀呀呀呀,又去奶奶家蹭中饭了图一图二沙子我双胞胎表弟们搭的花花和那只小狗的名字（因为我弟们和我爸过于喜欢看篮球赛取名小詹）图三我奶奶的心头宝贝就喜欢那几只鸭子图四是奶奶另外的一片小地我妈说正要买啥啥啥菜来着直接自己动了奶奶的地里的菜准备拿回家,,娄底·张家巷,,,0,0,1,2021-06-20 11:39,HUAWEI P20,"['http://ww1.sinaimg.cn/large/006xT24Pgy1groksmyfa4j32c0340e85.jpg', 'http://ww1.sinaimg.cn/large/006xT24Pgy1grokspqrazj32c0340b2d.jpg', 'http://ww1.sinaimg.cn/large/006xT24Pgy1grokssaqsfj33402c0e85.jpg', 'http://ww1.sinaimg.cn/large/006xT24Pgy1groksv4dnqj32c0340b2c.jpg']",,
4650128025059738,Kl23ElegG,2297871460,-艾AA-,男人，占着几千年来的性别红利，家里资源房产优先供给，婚姻法偏向只保护出资人，男人占着家里的大部分资源，自然受保护，还要求姓氏权，不用休陪产假，不用被问如何平衡家庭和工作，只会质问女人为什么不结婚生子，不帮他们延续劣质基因，就这种郭嘉，这种男性，还要求女人生三胎，不好意思，你们不配。,,,,,0,0,1,2021-06-20 11:39,HUAWEI P30,,,
4650127962931461,Kl23yciBD,6555367093,谮诟和蛹彡,发布了头条文章：《那些敢生三胎的，都是些什么人啊？》O那些敢生三胎的，都是些什么人啊？,http://t.cn/A6f7QB3d,,,,0,0,0,2021-06-20 11:39,微博 weibo.com,,,
4650127954021518,Kl23xgSbc,7380376609,是砚秋oo,//@小乔有猫:“说老婆三胎正好有了事业转型的机会——这句振聋发聩的话势必会被刻在中国广告史的耻辱柱上”,,,小乔有猫,,0,0,0,2021-06-20 11:39,全屏双摄 OPPO A5,,,4649569311525848
4650127804074821,Kl23ih62V,5931879628,毛建华之名,《变迁》三胎时代，中国人是不是应当修改《中华人民共和国收养法了》。那是一个独生子女时代的法律。,,,,,0,0,0,2021-06-20 11:38,金立超级续航M6Plus,,,
4650127731463045,Kl23b68Bv,6217102177,小凉凉jx,《幼儿园缴费单走红，家长看完倍感扎心，你还想生三胎吗？》幼儿园缴费单走红，看完账单很扎心，你还敢生三胎吗？一份贵阳市的一所幼儿园的缴费账单曝光，打破了人们所有的美好幻想。O网页链接生活压力真的养不起更要不起,,,,,0,0,0,2021-06-20 11:38,百度App,['http://ww1.sinaimg.cn/large/006MKkhzgy1grokvi5o4nj308o05saa4.jpg'],,
4650127509950690,Kl22OFKD0,7384023853,皮皮时光机琦琦,请搞快点//@泽维尔天赋青少年学院-保安-丞叽:不生三胎很难收场//@置换须臾-:这❓❓❓❓不do个几年能这么结实？//@77七噢七:以及：和wjl在一起久了都结实了x,,,"泽维尔天赋青少年学院-保安-丞叽,置换须臾-,77七噢七",,0,0,0,2021-06-20 11:37,HUAWEI P30 Pro,,,4649925432838627
4650127493173411,Kl22Ndjy3,1820542834,14u_14me,看完视频我真的以为是反讽，因为每个演员的话都避重就轻地开空头支票。直到我在评论区看到了拍摄该视频的公司老板(•︠ˍ•︡)//@杨烨炘ForestYoung:你有反对三胎的权利，我也有支持三胎的权利，一个健康的社会应该容得下不同的意见,,,杨烨炘ForestYoung,,0,0,0,2021-06-20 11:37,iPhone 12,,,4649569311525848
4650127342437052,Kl22yadZi,6871033283,您的甜豆豆,和wgx说到腾讯强制6点下班，又说到三胎政策。wgx：你说三个小孩咱俩养的起不？wgx：别说了，三条狗咱俩都养不起,,,,,0,0,1,2021-06-20 11:36,iPhone客户端,,,
4650127296561728,Kl22trx0k,1741538517,想冬眠的十万,我记得之前还有在派出所砍死的新闻//@Jack贝萨流士的badbed:不太理解哈，我寻思育龄女性离婚了找下一个一样能生，砍死了那可是几胎都没戏了。果然咱国家还是觉得女性数量太多了吧//@马库斯说://@Hu言一派:条条举措“帮助”落实你赶紧生三胎，但日常家暴离婚怎么保命，人家视而不见绝口不提,,,"Jack贝萨流士的badbed,马库斯说,Hu言一派",,10,1,2,2021-06-20 11:36,HUAWEI P40 5G,,,4649836395627774
4650127271135292,Kl22r4Lla,5637148879,And105,生孩子的又不是他们//@Mye3er·V:没有子宫就没发言权//@MarshallNdra:没有子宫就没有发言权//@有盐电影:采访一群生不了孩子的男人一个个眉飞色舞地说支持生三胎  文案还说难不倒父亲  生三胎难的是父亲吗？什么阴间广告策划（出自好看视频的父亲节广告,,,"Mye3er,MarshallNdra,有盐电影",,0,0,0,2021-06-20 11:36,iPhone 7,,,4649504262065885
